{
  "$schema": "https://json-schema.org/draft/2020-12/schema",
  "$id": "https://xianxia-engine.com/schemas/combat_system.json",
  "title": "Combat System Schema",
  "description": "Schema for combat system definitions",
  "type": "object",
  "required": ["meta", "combat_phases", "attack_resolution", "elemental_system", "status_effects"],
  "properties": {
    "meta": {"$ref": "#/$defs/metaInfo"},
    "combat_phases": {
      "type": "object",
      "additionalProperties": {
        "type": "object",
        "required": ["order", "name"],
        "properties": {
          "order": {"type": "integer"},
          "name": {"type": "string"},
          "steps": {"type": "array", "items": {"type": "string"}},
          "formula": {"type": "string"},
          "modifiers": {"type": "object"},
          "action_types": {"type": "object"}
        }
      }
    },
    "attack_resolution": {
      "type": "object",
      "properties": {
        "hit_calculation": {"type": "object"},
        "damage_calculation": {"type": "object"},
        "damage_types": {"type": "object"}
      }
    },
    "elemental_system": {
      "type": "object",
      "properties": {
        "basic_elements": {"type": "object"},
        "advanced_elements": {"type": "object"},
        "element_fusion": {"type": "object"}
      }
    },
    "status_effects": {
      "type": "object",
      "properties": {
        "buffs": {"type": "object"},
        "debuffs": {"type": "object"},
        "special_states": {"type": "object"}
      }
    },
    "special_mechanics": {"type": "object"},
    "ai_behavior": {"type": "object"},
    "combat_rewards": {"type": "object"},
    "combat_settings": {"type": "object"},
    "_custom_tags": {"$ref": "#/$defs/customTags"}
  },
  "$defs": {
    "metaInfo": {
      "type": "object",
      "required": ["version", "description", "schema_version"],
      "properties": {
        "version": {"type": "string", "pattern": "^\\d+\\.\\d+\\.\\d+$"},
        "description": {"type": "string"},
        "schema_version": {"type": "string"},
        "last_modified": {"type": "string", "format": "date"}
      }
    },
    "customTags": {
      "type": "array",
      "items": {"type": "string"}
    }
  }
}